{
  "$schema": "https://systems-phd-explorer.local/schemas/v1/paper-metadata.schema.json",
  "schema_version": "1.0.0",
  "paper_id": "sp-2025-trust-nobody-privacy-preserving-proofs-for-edited-photos-d7fd5ae4",
  "title": "Trust Nobody: Privacy-Preserving Proofs for Edited Photos with Your Laptop",
  "abstract": "The Internet has plenty of images that are transformations (e.g., resize, blur) of confidential original images. Several scenarios (e.g., selling images over the Internet, fighting disinformation, detecting deep fakes) would highly benefit from systems allowing to verify that an image is the result of a transformation applied to a confidential authentic image. In this paper, we focus on systems for proving and verifying the correctness of transformations of authentic images guaranteeing: 1) confidentiality (i.e., the original image remains private), 2) efficient proof generation (i.e., the proof certifying the correctness of the transformation can be computed with a common laptop) even for high-resolution images, 3) authenticity (i.e., only the advertised transformations have been applied) and 4) fast detection of fraud proofs.. Our contribution consists of new definitions modelling confidentiality and adaptive adversaries, techniques to speed up the prover of a ZK-snark, an efficient construction relying on ad-hoc signatures and hashes, and a less efficient construction that works according to signatures and hashes included in the C2PA specifications. Experimental results confirm the viability of our approach, allowing to compute an authentic transformation of a high-resolution image on a common computer. Prior results instead either require expensive computing resources or provide unsatisfying confidentiality.",
  "abstract_source_id": "src-abstract-sp-2025-d7fd5ae4",
  "venue": "sp",
  "year": 2025,
  "track_or_session": "Cycle 1",
  "paper_type": "main-track",
  "publication_date": "2025-05-01",
  "page_count": 19,
  "venue_year_completion_status": "COMPLETE_PROCEEDINGS",
  "authors": [
    {
      "author_id": null,
      "name": "Pierpaolo Della Monica",
      "position": 1,
      "orcid": null,
      "affiliations": [
        {
          "institution_id": null,
          "name_as_published": "Sapienza University of Rome,Italy",
          "normalized_name": null,
          "institution_type": "unknown",
          "city": null,
          "state_or_province": null,
          "country": null,
          "region": null,
          "source_ids": [
            "src-b3d809fb4d6dcca8-publisher"
          ]
        }
      ]
    },
    {
      "author_id": null,
      "name": "Ivan Visconti",
      "position": 2,
      "orcid": null,
      "affiliations": [
        {
          "institution_id": null,
          "name_as_published": "Sapienza University of Rome,Italy",
          "normalized_name": null,
          "institution_type": "unknown",
          "city": null,
          "state_or_province": null,
          "country": null,
          "region": null,
          "source_ids": [
            "src-b3d809fb4d6dcca8-publisher"
          ]
        }
      ]
    },
    {
      "author_id": null,
      "name": "Andrea Vitaletti",
      "position": 3,
      "orcid": null,
      "affiliations": [
        {
          "institution_id": null,
          "name_as_published": "Sapienza University of Rome,Italy",
          "normalized_name": null,
          "institution_type": "unknown",
          "city": null,
          "state_or_province": null,
          "country": null,
          "region": null,
          "source_ids": [
            "src-b3d809fb4d6dcca8-publisher"
          ]
        }
      ]
    },
    {
      "author_id": null,
      "name": "Marco Zecchini",
      "position": 4,
      "orcid": null,
      "affiliations": [
        {
          "institution_id": null,
          "name_as_published": "Sapienza University of Rome,Italy",
          "normalized_name": null,
          "institution_type": "unknown",
          "city": null,
          "state_or_province": null,
          "country": null,
          "region": null,
          "source_ids": [
            "src-b3d809fb4d6dcca8-publisher"
          ]
        }
      ]
    }
  ],
  "links": {
    "doi": "10.1109/sp61157.2025.00014",
    "official_page": "https://www.computer.org/csdl/proceedings-article/sp/2025/223600a014/21B7Q66yaAg",
    "official_pdf": "https://www.computer.org/csdl/api/v1/csdl/proceedings/download-article/21B7Q66yaAg/pdf",
    "artifact": null,
    "code": null,
    "project": null,
    "slides": null,
    "video": null,
    "bibtex": null
  },
  "alternate_versions": [],
  "sources": [
    {
      "id": "src-44a44df7102cd3a4-program",
      "url": "https://www.sp2025.ieee-security.org/accepted-papers.html",
      "kind": "conference-program",
      "title": "IEEE Symposium on Security and Privacy 2025 Accepted Papers",
      "publisher": "IEEE",
      "retrieved_at": "2026-07-29T23:46:51Z",
      "content_hash": null,
      "official": true,
      "supports": [
        "main-track acceptance, official title, and submission cycle"
      ]
    },
    {
      "id": "src-b3d809fb4d6dcca8-publisher",
      "url": "https://www.computer.org/csdl/proceedings-article/sp/2025/223600a014/21B7Q66yaAg",
      "kind": "publisher-page",
      "title": "Trust Nobody: Privacy-Preserving Proofs for Edited Photos with Your Laptop",
      "publisher": "IEEE Computer Society",
      "retrieved_at": "2026-07-29T23:46:51Z",
      "content_hash": null,
      "official": true,
      "supports": [
        "DOI, authors, affiliations, abstract, publication date, pages, and PDF"
      ]
    },
    {
      "id": "src-abstract-sp-2025-d7fd5ae4",
      "url": "https://api.semanticscholar.org/graph/v1/paper/batch?fields=title,abstract,externalIds",
      "kind": "semantic-scholar",
      "title": "Trust Nobody: Privacy-Preserving Proofs for Edited Photos with Your Laptop",
      "publisher": "Semantic Scholar",
      "retrieved_at": "2026-09-15T22:57:52Z",
      "content_hash": "sha256:b15ce02bcc49da611fdd791ecc56741e7d91d84154b58c1a7f72a5c6902e6e46",
      "official": false,
      "supports": [
        "Published abstract text."
      ]
    }
  ],
  "workflow": {
    "status": "READY_FOR_REVIEW",
    "owner": "agent-d",
    "updated_at": "2026-07-29T23:46:51Z",
    "notes": [
      "Canonical conference metadata collected from the official program and publisher or paper page."
    ]
  },
  "verification": {
    "collected_at": "2026-07-29T23:46:51Z",
    "last_verified_at": "2026-07-29T23:46:51Z",
    "collector_version": "agent-d-security-collector/1.0",
    "confidence": "HIGH",
    "verified_by": "agent-d",
    "unresolved_fields": []
  }
}
