{
  "$schema": "https://systems-phd-explorer.local/schemas/v1/paper-metadata.schema.json",
  "schema_version": "1.0.0",
  "paper_id": "usenix-security-2024-double-face-leveraging-user-intelligence-to-characterize-c79d81da",
  "title": "Double Face: Leveraging User Intelligence to Characterize and Recognize AI-synthesized Faces",
  "abstract": "Artificial Intelligence (AI) techniques have advanced to generate face images of nonexistent yet photorealistic persons. Despite positive applications, AI-synthesized faces have been increasingly abused to deceive users and manipulate opinions, such as AI-generated profile photos for fake accounts. Deception using generated realistic-appearing images raises severe trust and security concerns. So far, techniques to analyze and recognize AI-synthesized face images are limited, mainly relying on off-the-shelf classification methods or heuristics of researchers' individual perceptions.\n\nAs a complement to existing analysis techniques, we develop a novel approach that leverages crowdsourcing annotations to analyze and defend against AI-synthesized face images. We aggregate and characterize AI-synthesis artifacts annotated by multiple users (instead of by individual researchers or automated systems). Our quantitative findings systematically identify where the synthesis artifacts are likely to be located and what characteristics the synthesis patterns have. We further incorporate user annotated regions into an attention learning approach to detect AI-synthesized faces. Our work sheds light on involving human factors to enhance defense against AI-synthesized face images.",
  "abstract_source_id": "src-abstract-usenix-security-2024-c79d81da",
  "venue": "usenix-security",
  "year": 2024,
  "track_or_session": "Deepfake and Synthesis",
  "paper_type": "main-track",
  "publication_date": null,
  "page_count": 18,
  "venue_year_completion_status": "COMPLETE_PROCEEDINGS",
  "authors": [
    {
      "author_id": null,
      "name": "Matthew Joslin",
      "position": 1,
      "orcid": null,
      "affiliations": [
        {
          "institution_id": null,
          "name_as_published": "University of Texas at Dallas",
          "normalized_name": null,
          "institution_type": "unknown",
          "city": null,
          "state_or_province": null,
          "country": null,
          "region": null,
          "source_ids": [
            "src-7d9f078d2e4942cc-paper"
          ]
        }
      ]
    },
    {
      "author_id": null,
      "name": "Xian Wang",
      "position": 2,
      "orcid": null,
      "affiliations": [
        {
          "institution_id": null,
          "name_as_published": "University of Texas at Dallas",
          "normalized_name": null,
          "institution_type": "unknown",
          "city": null,
          "state_or_province": null,
          "country": null,
          "region": null,
          "source_ids": [
            "src-7d9f078d2e4942cc-paper"
          ]
        }
      ]
    },
    {
      "author_id": null,
      "name": "Shuang Hao",
      "position": 3,
      "orcid": null,
      "affiliations": [
        {
          "institution_id": null,
          "name_as_published": "University of Texas at Dallas",
          "normalized_name": null,
          "institution_type": "unknown",
          "city": null,
          "state_or_province": null,
          "country": null,
          "region": null,
          "source_ids": [
            "src-7d9f078d2e4942cc-paper"
          ]
        }
      ]
    }
  ],
  "links": {
    "doi": null,
    "official_page": "https://www.usenix.org/conference/usenixsecurity24/presentation/joslin",
    "official_pdf": "https://www.usenix.org/system/files/usenixsecurity24-joslin.pdf",
    "artifact": null,
    "code": null,
    "project": null,
    "slides": null,
    "video": null,
    "bibtex": "@inproceedings {299603,\nauthor = {Matthew Joslin and Xian Wang and Shuang Hao},\ntitle = {Double Face: Leveraging User Intelligence to Characterize and Recognize {AI-synthesized} Faces},\nbooktitle = {33rd USENIX Security Symposium (USENIX Security 24)},\nyear = {2024},\nisbn = {978-1-939133-44-1},\naddress = {Philadelphia, PA},\npages = {1009--1026},\nurl = {https://www.usenix.org/conference/usenixsecurity24/presentation/joslin},\npublisher = {USENIX Association},\nmonth = aug\n}"
  },
  "alternate_versions": [],
  "sources": [
    {
      "id": "src-15df1eb4a68c19cb-program",
      "url": "https://www.usenix.org/conference/usenixsecurity24/technical-sessions",
      "kind": "conference-program",
      "title": "USENIX Security 2024 Technical Sessions",
      "publisher": "USENIX Association",
      "retrieved_at": "2026-07-30T00:17:50Z",
      "content_hash": null,
      "official": true,
      "supports": [
        "main-track program membership and session"
      ]
    },
    {
      "id": "src-7d9f078d2e4942cc-paper",
      "url": "https://www.usenix.org/conference/usenixsecurity24/presentation/joslin",
      "kind": "paper-page",
      "title": "Double Face: Leveraging User Intelligence to Characterize and Recognize AI-synthesized Faces",
      "publisher": "USENIX Association",
      "retrieved_at": "2026-07-30T00:17:50Z",
      "content_hash": null,
      "official": true,
      "supports": [
        "authors, affiliations, abstract, page span, PDF, and BibTeX when exposed"
      ]
    },
    {
      "id": "src-abstract-usenix-security-2024-c79d81da",
      "url": "https://www.usenix.org/conference/usenixsecurity24/presentation/joslin",
      "kind": "paper-page",
      "title": "Double Face: Leveraging User Intelligence to Characterize and Recognize AI-synthesized Faces",
      "publisher": "USENIX",
      "retrieved_at": "2026-09-15T22:14:54Z",
      "content_hash": "sha256:4a0a8e03fb8c733b184aa15046865d3f24d84e48b403e365e3d99beecacb4705",
      "official": true,
      "supports": [
        "Published abstract text."
      ]
    }
  ],
  "workflow": {
    "status": "READY_FOR_REVIEW",
    "owner": "agent-d",
    "updated_at": "2026-07-30T00:17:50Z",
    "notes": [
      "Canonical conference metadata collected from the official program and publisher or paper page."
    ]
  },
  "verification": {
    "collected_at": "2026-07-30T00:17:50Z",
    "last_verified_at": "2026-07-30T00:17:50Z",
    "collector_version": "agent-d-security-collector/1.1",
    "confidence": "MEDIUM",
    "verified_by": "agent-d",
    "unresolved_fields": [
      "publication_date"
    ]
  }
}
