{
  "$schema": "https://systems-phd-explorer.local/schemas/v1/paper-metadata.schema.json",
  "schema_version": "1.0.0",
  "paper_id": "sp-2023-breaking-security-critical-voice-authentication-5a6511e4",
  "title": "Breaking Security-Critical Voice Authentication",
  "abstract": "Voice authentication (VA) has recently become an integral part in numerous security-critical operations, such as bank transactions and call center conversations. The vulnerability of automatic speaker verification systems (ASVs) to spoofing attacks instigated the development of countermeasures (CMs), whose task is to differentiate between bonafide and spoofed speech. Together, ASVs and CMs form today’s VA systems and are being advertised as an impregnable access control mechanism. We develop the first practical attack on spoofing countermeasures, and demonstrate how a malicious actor may efficiently craft audio samples against these defenses. Previous adversarial attacks against VA have been mainly designed for the whitebox scenario, which assumes knowledge of the system’s internals, or requires large query and time budgets to launch target-specific attacks. When attacking a security-critical system, these assumptions do not hold. Our attack, on the other hand, targets common points of failure that all spoofing countermeasures share, making it real-time, model-agnostic, and completely blackbox without the need to interact with the target to craft the attack samples. The key message from our work is that CMs mistakenly learn to distinguish between spoofed and bonafide audio based on cues that are easily identifiable and forgeable. The effects of our attack are subtle enough to guarantee that these adversarial samples can still bypass the ASV as well and preserve their original textual contents. These properties combined make for a powerful attack that can bypass security-critical VA in its strictest form, yielding success rates of up to 99% with only 6 attempts. Finally, we perform the first targeted, over-telephony-network attack on CMs, bypassing several known challenges and enabling a variety of potential threats, given the increased use of voice biometrics in call centers. Our results call into question the security of modern VA systems and urge users to rethink their trust in them, in light of the real threat of attackers bypassing these measures to gain access to their most valuable resources.",
  "abstract_source_id": "src-abstract-sp-2023-5a6511e4",
  "venue": "sp",
  "year": 2023,
  "track_or_session": "Session 4A: Biometric security",
  "paper_type": "main-track",
  "publication_date": "2023-05-01",
  "page_count": 18,
  "venue_year_completion_status": "COMPLETE_PROCEEDINGS",
  "authors": [
    {
      "author_id": null,
      "name": "Andre Kassis",
      "position": 1,
      "orcid": null,
      "affiliations": [
        {
          "institution_id": null,
          "name_as_published": "University of Waterloo, Canada",
          "normalized_name": null,
          "institution_type": "unknown",
          "city": null,
          "state_or_province": null,
          "country": null,
          "region": null,
          "source_ids": [
            "src-2399433d9166af37-schedule"
          ]
        }
      ]
    },
    {
      "author_id": null,
      "name": "Urs Hengartner",
      "position": 2,
      "orcid": null,
      "affiliations": [
        {
          "institution_id": null,
          "name_as_published": "University of Waterloo, Canada",
          "normalized_name": null,
          "institution_type": "unknown",
          "city": null,
          "state_or_province": null,
          "country": null,
          "region": null,
          "source_ids": [
            "src-2399433d9166af37-schedule"
          ]
        }
      ]
    }
  ],
  "links": {
    "doi": "10.1109/sp46215.2023.10179374",
    "official_page": "https://doi.org/10.1109/SP46215.2023.10179374",
    "official_pdf": "http://xplorestaging.ieee.org/ielx7/10179215/10179280/10179374.pdf?arnumber=10179374",
    "artifact": null,
    "code": null,
    "project": null,
    "slides": null,
    "video": null,
    "bibtex": null
  },
  "alternate_versions": [],
  "sources": [
    {
      "id": "src-e64426c734946e0f-program",
      "url": "https://www.ieee-security.org/TC/SP2023/program-papers.html",
      "kind": "conference-program",
      "title": "IEEE Symposium on Security and Privacy 2023 Accepted Papers",
      "publisher": "IEEE",
      "retrieved_at": "2026-07-30T01:39:19Z",
      "content_hash": null,
      "official": true,
      "supports": [
        "main-track acceptance and official accepted title"
      ]
    },
    {
      "id": "src-2399433d9166af37-schedule",
      "url": "https://www.ieee-security.org/TC/SP2023/program.html",
      "kind": "conference-program",
      "title": "IEEE Symposium on Security and Privacy 2023 Program",
      "publisher": "IEEE",
      "retrieved_at": "2026-07-30T01:39:19Z",
      "content_hash": null,
      "official": true,
      "supports": [
        "session, authors, and affiliations"
      ]
    },
    {
      "id": "src-48acc64d2b67052c-publisher",
      "url": "https://doi.org/10.1109/SP46215.2023.10179374",
      "kind": "publisher-page",
      "title": "Breaking Security-Critical Voice Authentication",
      "publisher": "IEEE Computer Society",
      "retrieved_at": "2026-07-30T01:39:19Z",
      "content_hash": null,
      "official": true,
      "supports": [
        "DOI and canonical publisher record"
      ]
    },
    {
      "id": "src-e25184c09b13c6e4-crossref",
      "url": "https://api.crossref.org/works/10.1109/sp46215.2023.10179374",
      "kind": "crossref",
      "title": "Breaking Security-Critical Voice Authentication",
      "publisher": "Crossref",
      "retrieved_at": "2026-07-30T01:39:19Z",
      "content_hash": null,
      "official": false,
      "supports": [
        "publication date, page span, and official PDF link"
      ]
    },
    {
      "id": "src-6718c0282b848c62-abstract",
      "url": "https://openalex.org/W4385080277",
      "kind": "openalex",
      "title": "Breaking Security-Critical Voice Authentication",
      "publisher": "OpenAlex",
      "retrieved_at": "2026-07-30T01:39:19Z",
      "content_hash": null,
      "official": false,
      "supports": [
        "abstract used for relevance screening"
      ]
    },
    {
      "id": "src-abstract-sp-2023-5a6511e4",
      "url": "https://api.semanticscholar.org/graph/v1/paper/batch?fields=title,abstract,externalIds",
      "kind": "semantic-scholar",
      "title": "Breaking Security-Critical Voice Authentication",
      "publisher": "Semantic Scholar",
      "retrieved_at": "2026-09-15T22:57:22Z",
      "content_hash": "sha256:1bed15e4c1c4d6e59eecfd74eeffd17f506467abd5cdd4e0f536f68bd1e694ee",
      "official": false,
      "supports": [
        "Published abstract text."
      ]
    }
  ],
  "workflow": {
    "status": "READY_FOR_REVIEW",
    "owner": "agent-d",
    "updated_at": "2026-07-30T01:39:19Z",
    "notes": [
      "Canonical conference metadata collected from the official program and publisher or paper page."
    ]
  },
  "verification": {
    "collected_at": "2026-07-30T01:39:19Z",
    "last_verified_at": "2026-07-30T01:39:19Z",
    "collector_version": "agent-d-security-collector/1.2",
    "confidence": "HIGH",
    "verified_by": "agent-d",
    "unresolved_fields": []
  }
}
