{
  "$schema": "https://systems-phd-explorer.local/schemas/v1/paper-metadata.schema.json",
  "schema_version": "1.0.0",
  "paper_id": "asplos-2023-noswalker-a-decoupled-architecture-for-out-of-core-rando-d759268b",
  "title": "NosWalker: A Decoupled Architecture for Out-of-Core Random Walk Processing",
  "abstract": "Out-of-core random walk system has recently attracted a lot of attention as an economical way to run billions of walkers over large graphs. However, existing out-of-core random walk systems are all built upon general out-of-core graph processing frameworks, and hence do not take advantage of the unique properties of random walk applications. Different from traditional graph analysis algorithms, the sampling process of random walk can be decoupled from the processing of the walkers. It enables the system to reserve only pre-sample results in memory, which are typically much smaller than the entire edge set. Moreover, in random walk, it is not the number of walkers but the number of steps moved per second that dominates the overall performance. Thus, with independent walkers, there is no need to process all the walkers simultaneously.",
  "abstract_source_id": "src-abstract-asplos-2023-d759268b",
  "venue": "asplos",
  "year": 2023,
  "track_or_session": "Session 6C: Graphs A",
  "paper_type": "main-track",
  "publication_date": "2023-03-25",
  "page_count": 17,
  "venue_year_completion_status": "COMPLETE_PROCEEDINGS",
  "authors": [
    {
      "author_id": null,
      "name": "Shuke Wang",
      "position": 1,
      "orcid": null,
      "affiliations": [
        {
          "institution_id": null,
          "name_as_published": "Tsinghua University, China",
          "normalized_name": null,
          "institution_type": "unknown",
          "city": null,
          "state_or_province": null,
          "country": null,
          "region": null,
          "source_ids": [
            "src-crossref-3582016-3582025"
          ]
        }
      ]
    },
    {
      "author_id": null,
      "name": "MingXing Zhang",
      "position": 2,
      "orcid": null,
      "affiliations": [
        {
          "institution_id": null,
          "name_as_published": "Tsinghua University, China",
          "normalized_name": null,
          "institution_type": "unknown",
          "city": null,
          "state_or_province": null,
          "country": null,
          "region": null,
          "source_ids": [
            "src-crossref-3582016-3582025"
          ]
        }
      ]
    },
    {
      "author_id": null,
      "name": "Ke Yang",
      "position": 3,
      "orcid": null,
      "affiliations": [
        {
          "institution_id": null,
          "name_as_published": "Tsinghua University, China / Beijing HaiZhi XingTu Technology, China",
          "normalized_name": null,
          "institution_type": "unknown",
          "city": null,
          "state_or_province": null,
          "country": null,
          "region": null,
          "source_ids": [
            "src-crossref-3582016-3582025"
          ]
        }
      ]
    },
    {
      "author_id": null,
      "name": "Kang Chen",
      "position": 4,
      "orcid": null,
      "affiliations": [
        {
          "institution_id": null,
          "name_as_published": "Tsinghua University, China",
          "normalized_name": null,
          "institution_type": "unknown",
          "city": null,
          "state_or_province": null,
          "country": null,
          "region": null,
          "source_ids": [
            "src-crossref-3582016-3582025"
          ]
        }
      ]
    },
    {
      "author_id": null,
      "name": "Shaonan Ma",
      "position": 5,
      "orcid": null,
      "affiliations": [
        {
          "institution_id": null,
          "name_as_published": "Tsinghua University, China",
          "normalized_name": null,
          "institution_type": "unknown",
          "city": null,
          "state_or_province": null,
          "country": null,
          "region": null,
          "source_ids": [
            "src-crossref-3582016-3582025"
          ]
        }
      ]
    },
    {
      "author_id": null,
      "name": "Jinlei Jiang",
      "position": 6,
      "orcid": null,
      "affiliations": [
        {
          "institution_id": null,
          "name_as_published": "Tsinghua University, China",
          "normalized_name": null,
          "institution_type": "unknown",
          "city": null,
          "state_or_province": null,
          "country": null,
          "region": null,
          "source_ids": [
            "src-crossref-3582016-3582025"
          ]
        }
      ]
    },
    {
      "author_id": null,
      "name": "Yongwei Wu",
      "position": 7,
      "orcid": null,
      "affiliations": [
        {
          "institution_id": null,
          "name_as_published": "Tsinghua University, China",
          "normalized_name": null,
          "institution_type": "unknown",
          "city": null,
          "state_or_province": null,
          "country": null,
          "region": null,
          "source_ids": [
            "src-crossref-3582016-3582025"
          ]
        }
      ]
    }
  ],
  "links": {
    "doi": "10.1145/3582016.3582025",
    "official_page": "https://dl.acm.org/doi/10.1145/3582016.3582025",
    "official_pdf": null,
    "artifact": null,
    "code": null,
    "project": null,
    "slides": null,
    "video": "https://youtu.be/OhrXIKLsYxc",
    "bibtex": null
  },
  "alternate_versions": [],
  "sources": [
    {
      "id": "src-asplos-2023-program",
      "url": "https://asplos-conference.org/asplos2023/index.html%3Fp%3D3602.html",
      "kind": "conference-program",
      "title": "Program – ASPLOS 2023",
      "publisher": "ASPLOS",
      "retrieved_at": "2026-07-30T02:00:48Z",
      "content_hash": "sha256:b1f7ebd4f5650ff7bf1046a1bb8140dba70b237cd7059fe48a600e85d9e05435",
      "official": true,
      "supports": [
        "Conference dates, 27 numbered technical sessions, canonical displayed titles, ordered displayed authors, DOI links, and paper-level lightning-talk links."
      ]
    },
    {
      "id": "src-crossref-3582016-3582025",
      "url": "https://api.crossref.org/works/10.1145/3582016.3582025",
      "kind": "crossref",
      "title": "NosWalker: A Decoupled Architecture for Out-of-Core Random Walk Processing",
      "publisher": "Crossref (metadata deposited by ACM)",
      "retrieved_at": "2026-07-30T02:00:48Z",
      "content_hash": "sha256:77c7cf16af99bb966d0c0dc99c0137f257d4c3090d965f4a9d196ee8cc2c6848",
      "official": false,
      "supports": [
        "Publisher-deposited ordered authors, publication-time affiliations, page range, publication date, and ACM links."
      ]
    },
    {
      "id": "src-semantic-scholar-3582016-3582025",
      "url": "https://www.semanticscholar.org/paper/231b88e974b3117fbbeade9fa4f758ed4f15369b",
      "kind": "semantic-scholar",
      "title": "NosWalker: A Decoupled Architecture for Out-of-Core Random Walk Processing",
      "publisher": "Semantic Scholar",
      "retrieved_at": "2026-07-30T02:00:48Z",
      "content_hash": "sha256:29b2f6f9ce66938f6a27d6eae962de76972f9916f0a64f030bae61bd57c2a8fa",
      "official": false,
      "supports": [
        "Indexed abstract used with the official technical-session context for relevance classification, plus alternate-copy and explicitly printed ancillary links."
      ]
    },
    {
      "id": "src-abstract-asplos-2023-d759268b",
      "url": "https://api.openalex.org/works/doi:10.1145/3582016.3582025?select=id,title,abstract_inverted_index&mailto=asnicoria%40gmail.com",
      "kind": "openalex",
      "title": "NosWalker: A Decoupled Architecture for Out-of-Core Random Walk Processing",
      "publisher": "OpenAlex",
      "retrieved_at": "2026-09-15T21:59:36Z",
      "content_hash": "sha256:1779686c4c09cf19e97d3b68e4fcc54c090458fa8d49e91a64abf36b7efc181f",
      "official": false,
      "supports": [
        "Published abstract text."
      ]
    }
  ],
  "workflow": {
    "status": "READY_FOR_REVIEW",
    "owner": "agent-c",
    "updated_at": "2026-07-30T02:00:48Z",
    "notes": [
      "The canonical title, technical session, DOI, displayed author order, and lightning-talk link follow the official ASPLOS 2023 program.",
      "Publication dates, page ranges, and full affiliation strings use name-matched publisher-deposited Crossref records; those records expose no author ORCIDs.",
      "No PDF, artifact, code, project, slide, BibTeX, or alternate-version URL was inferred when the audited sources did not expose one."
    ]
  },
  "verification": {
    "collected_at": "2026-07-30T02:00:48Z",
    "last_verified_at": "2026-07-30T02:00:48Z",
    "collector_version": "agent-c-asplos-2023/1.0",
    "confidence": "HIGH",
    "verified_by": "agent-c",
    "unresolved_fields": [
      "authors[*].author_id",
      "authors[*].orcid",
      "authors[*].affiliations[*].normalized_name",
      "authors[*].affiliations[*].institution_type",
      "authors[*].affiliations[*].structured_geography",
      "links.slides",
      "links.bibtex",
      "links.official_pdf",
      "links.artifact",
      "links.code",
      "links.project",
      "alternate_versions"
    ]
  }
}
