{
  "$schema": "https://systems-phd-explorer.local/schemas/v1/paper-metadata.schema.json",
  "schema_version": "1.0.0",
  "paper_id": "usenix-security-2024-pure-payments-with-uwb-relay-protection-945305fc",
  "title": "PURE: Payments with UWB RElay-protection",
  "abstract": "Contactless payments are now widely used and are expected to reach $10 trillion worth of transactions by 2027. Although convenient, contactless payments are vulnerable to relay attacks that enable attackers to execute fraudulent payments. A number of countermeasures have been proposed to address this issue, including Mastercard's relay protection mechanism. These countermeasures, although effective against some Commercial off-the-shelf (COTS) relays, fail to prevent physical-layer relay attacks.\n\nIn this work, we leverage the Ultra-Wide Band (UWB) radios incorporated in major smartphones, smartwatches, tags and accessories, and introduce PURE, the first UWB-based relay protection that integrates smoothly into existing contactless payment standards, and prevents even the most sophisticated physical layer attacks. PURE extends EMV payment protocols that are executed between cards and terminals, and does not require any modification to the backend of the issuer, acquirer, or payment network. PURE further tailors UWB ranging to the payment environment (i.e., wireless channels) to achieve both reliability and resistance to all known physical-layer distance reduction attacks against UWB 802.15.4z. We implement PURE within the EMV standard on modern smartphones, and evaluate its performance in a realistic deployment. Our experiments show that PURE provides a sub-meter relay protection with minimal execution overhead (41 ms). We formally verify the security of PURE's integration within Mastercard's EMV protocol using the Tamarin prover.",
  "abstract_source_id": "src-abstract-usenix-security-2024-945305fc",
  "venue": "usenix-security",
  "year": 2024,
  "track_or_session": "Mobile Security II",
  "paper_type": "main-track",
  "publication_date": null,
  "page_count": 17,
  "venue_year_completion_status": "COMPLETE_PROCEEDINGS",
  "authors": [
    {
      "author_id": null,
      "name": "Daniele Coppola",
      "position": 1,
      "orcid": null,
      "affiliations": [
        {
          "institution_id": null,
          "name_as_published": "ETH Zurich",
          "normalized_name": null,
          "institution_type": "unknown",
          "city": null,
          "state_or_province": null,
          "country": null,
          "region": null,
          "source_ids": [
            "src-62bc0938688c6962-paper"
          ]
        }
      ]
    },
    {
      "author_id": null,
      "name": "Giovanni Camurati",
      "position": 2,
      "orcid": null,
      "affiliations": [
        {
          "institution_id": null,
          "name_as_published": "ETH Zurich",
          "normalized_name": null,
          "institution_type": "unknown",
          "city": null,
          "state_or_province": null,
          "country": null,
          "region": null,
          "source_ids": [
            "src-62bc0938688c6962-paper"
          ]
        }
      ]
    },
    {
      "author_id": null,
      "name": "Claudio Anliker",
      "position": 3,
      "orcid": null,
      "affiliations": [
        {
          "institution_id": null,
          "name_as_published": "ETH Zurich",
          "normalized_name": null,
          "institution_type": "unknown",
          "city": null,
          "state_or_province": null,
          "country": null,
          "region": null,
          "source_ids": [
            "src-62bc0938688c6962-paper"
          ]
        }
      ]
    },
    {
      "author_id": null,
      "name": "Xenia Hofmeier",
      "position": 4,
      "orcid": null,
      "affiliations": [
        {
          "institution_id": null,
          "name_as_published": "ETH Zurich",
          "normalized_name": null,
          "institution_type": "unknown",
          "city": null,
          "state_or_province": null,
          "country": null,
          "region": null,
          "source_ids": [
            "src-62bc0938688c6962-paper"
          ]
        }
      ]
    },
    {
      "author_id": null,
      "name": "Patrick Schaller",
      "position": 5,
      "orcid": null,
      "affiliations": [
        {
          "institution_id": null,
          "name_as_published": "ETH Zurich",
          "normalized_name": null,
          "institution_type": "unknown",
          "city": null,
          "state_or_province": null,
          "country": null,
          "region": null,
          "source_ids": [
            "src-62bc0938688c6962-paper"
          ]
        }
      ]
    },
    {
      "author_id": null,
      "name": "David A. Basin",
      "position": 6,
      "orcid": null,
      "affiliations": [
        {
          "institution_id": null,
          "name_as_published": "ETH Zurich",
          "normalized_name": null,
          "institution_type": "unknown",
          "city": null,
          "state_or_province": null,
          "country": null,
          "region": null,
          "source_ids": [
            "src-62bc0938688c6962-paper"
          ]
        }
      ]
    },
    {
      "author_id": null,
      "name": "Srdjan Capkun",
      "position": 7,
      "orcid": null,
      "affiliations": [
        {
          "institution_id": null,
          "name_as_published": "ETH Zurich",
          "normalized_name": null,
          "institution_type": "unknown",
          "city": null,
          "state_or_province": null,
          "country": null,
          "region": null,
          "source_ids": [
            "src-62bc0938688c6962-paper"
          ]
        }
      ]
    }
  ],
  "links": {
    "doi": null,
    "official_page": "https://www.usenix.org/conference/usenixsecurity24/presentation/coppola",
    "official_pdf": "https://www.usenix.org/system/files/usenixsecurity24-coppola.pdf",
    "artifact": null,
    "code": null,
    "project": null,
    "slides": "https://www.usenix.org/system/files/usenixsecurity24_slides-coppola.pdf",
    "video": null,
    "bibtex": "@inproceedings {298222,\nauthor = {Daniele Coppola and Giovanni Camurati and Claudio Anliker and Xenia Hofmeier and Patrick Schaller and David Basin and Srdjan Capkun},\ntitle = {{PURE}: Payments with {UWB} {RElay-protection}},\nbooktitle = {33rd USENIX Security Symposium (USENIX Security 24)},\nyear = {2024},\nisbn = {978-1-939133-44-1},\naddress = {Philadelphia, PA},\npages = {4553--4569},\nurl = {https://www.usenix.org/conference/usenixsecurity24/presentation/coppola},\npublisher = {USENIX Association},\nmonth = aug\n}"
  },
  "alternate_versions": [],
  "sources": [
    {
      "id": "src-03162142fbc26eb2-program",
      "url": "https://www.usenix.org/conference/usenixsecurity24/technical-sessions",
      "kind": "conference-program",
      "title": "USENIX Security 2024 Technical Sessions",
      "publisher": "USENIX Association",
      "retrieved_at": "2026-07-30T00:17:50Z",
      "content_hash": null,
      "official": true,
      "supports": [
        "main-track program membership and session"
      ]
    },
    {
      "id": "src-62bc0938688c6962-paper",
      "url": "https://www.usenix.org/conference/usenixsecurity24/presentation/coppola",
      "kind": "paper-page",
      "title": "PURE: Payments with UWB RElay-protection",
      "publisher": "USENIX Association",
      "retrieved_at": "2026-07-30T00:17:50Z",
      "content_hash": null,
      "official": true,
      "supports": [
        "authors, affiliations, abstract, page span, PDF, and BibTeX when exposed"
      ]
    },
    {
      "id": "src-abstract-usenix-security-2024-945305fc",
      "url": "https://www.usenix.org/conference/usenixsecurity24/presentation/coppola",
      "kind": "paper-page",
      "title": "PURE: Payments with UWB RElay-protection",
      "publisher": "USENIX",
      "retrieved_at": "2026-09-15T22:16:50Z",
      "content_hash": "sha256:0ced5ffd7873f6db64d49d9c9a2819bfabf5941b760606c5e08f7a888cd128e5",
      "official": true,
      "supports": [
        "Published abstract text."
      ]
    }
  ],
  "workflow": {
    "status": "READY_FOR_REVIEW",
    "owner": "agent-d",
    "updated_at": "2026-07-30T00:17:50Z",
    "notes": [
      "Canonical conference metadata collected from the official program and publisher or paper page."
    ]
  },
  "verification": {
    "collected_at": "2026-07-30T00:17:50Z",
    "last_verified_at": "2026-07-30T00:17:50Z",
    "collector_version": "agent-d-security-collector/1.1",
    "confidence": "MEDIUM",
    "verified_by": "agent-d",
    "unresolved_fields": [
      "publication_date"
    ]
  }
}
