{
  "$schema": "https://systems-phd-explorer.local/schemas/v1/paper-metadata.schema.json",
  "schema_version": "1.0.0",
  "paper_id": "ndss-2025-starshields-for-ios-navigating-the-security-cosmos-in-sa-6c204470",
  "title": "Starshields for iOS: Navigating the Security Cosmos in Satellite Communication",
  "abstract": "Apple has integrated satellite communication into their latest iPhones, enabling emergency communication, road- side assistance, location sharing with friends, iMessage, and SMS. This technology allows communication when other wireless services are unavailable. However, the use of satellites poses restrictions on bandwidth and delay, making it difficult to use modern communication protocols with their security and privacy guarantees. To overcome these challenges, Apple designed and implemented a proprietary satellite communication protocol to address these limitations. We are the first to successfully reverse-engineer this protocol and analyze its security and privacy properties. In addition, we develop a simulation-based testbed for testing emergency services without causing emergency calls. Our tests reveal protocol and infrastructure design issues. For example, compact protocol messages come at the cost of missing integrity protection and require an internet-based setup phase. We further demonstrate various restriction bypasses, such as misusing location sharing to send arbitrary text messages on old iOS versions, and sending iMessages over satellite from region-locked countries. These bypasses allow us to overcome censorship and operator control of text messaging services.",
  "abstract_source_id": "src-abstract-ndss-2025-6c204470",
  "venue": "ndss",
  "year": 2025,
  "track_or_session": "Fall submission cycle",
  "paper_type": "main-track",
  "publication_date": "2025-02-24",
  "page_count": null,
  "venue_year_completion_status": "COMPLETE_PROCEEDINGS",
  "authors": [
    {
      "author_id": null,
      "name": "Jiska Classen",
      "position": 1,
      "orcid": null,
      "affiliations": [
        {
          "institution_id": null,
          "name_as_published": "Hasso Plattner Institute, University of Potsdam",
          "normalized_name": null,
          "institution_type": "unknown",
          "city": null,
          "state_or_province": null,
          "country": null,
          "region": null,
          "source_ids": [
            "src-891244f5f04e10d2-paper"
          ]
        }
      ]
    },
    {
      "author_id": null,
      "name": "Alexander Heinrich",
      "position": 2,
      "orcid": null,
      "affiliations": [
        {
          "institution_id": null,
          "name_as_published": "TU Darmstadt, Germany",
          "normalized_name": null,
          "institution_type": "unknown",
          "city": null,
          "state_or_province": null,
          "country": null,
          "region": null,
          "source_ids": [
            "src-891244f5f04e10d2-paper"
          ]
        }
      ]
    },
    {
      "author_id": null,
      "name": "Fabian Portner",
      "position": 3,
      "orcid": null,
      "affiliations": [
        {
          "institution_id": null,
          "name_as_published": "TU Darmstadt, Germany",
          "normalized_name": null,
          "institution_type": "unknown",
          "city": null,
          "state_or_province": null,
          "country": null,
          "region": null,
          "source_ids": [
            "src-891244f5f04e10d2-paper"
          ]
        }
      ]
    },
    {
      "author_id": null,
      "name": "Felix Rohrbach",
      "position": 4,
      "orcid": null,
      "affiliations": [
        {
          "institution_id": null,
          "name_as_published": "TU Darmstadt, Germany",
          "normalized_name": null,
          "institution_type": "unknown",
          "city": null,
          "state_or_province": null,
          "country": null,
          "region": null,
          "source_ids": [
            "src-891244f5f04e10d2-paper"
          ]
        }
      ]
    },
    {
      "author_id": null,
      "name": "Matthias Hollick",
      "position": 5,
      "orcid": null,
      "affiliations": [
        {
          "institution_id": null,
          "name_as_published": "TU Darmstadt, Germany",
          "normalized_name": null,
          "institution_type": "unknown",
          "city": null,
          "state_or_province": null,
          "country": null,
          "region": null,
          "source_ids": [
            "src-891244f5f04e10d2-paper"
          ]
        }
      ]
    }
  ],
  "links": {
    "doi": "10.14722/ndss.2025.240124",
    "official_page": "https://www.ndss-symposium.org/ndss-paper/starshields-for-ios-navigating-the-security-cosmos-in-satellite-communication/",
    "official_pdf": "https://www.ndss-symposium.org/wp-content/uploads/2025-124-paper.pdf",
    "artifact": null,
    "code": null,
    "project": null,
    "slides": "https://www.ndss-symposium.org/wp-content/uploads/3B-f0124-classen.pdf",
    "video": "https://youtu.be/jY3idyn11Tc",
    "bibtex": null
  },
  "alternate_versions": [],
  "sources": [
    {
      "id": "src-135c9b6b22d6cd90-program",
      "url": "https://www.ndss-symposium.org/ndss2025/accepted-papers/",
      "kind": "conference-program",
      "title": "NDSS Symposium 2025 Accepted Papers",
      "publisher": "Internet Society",
      "retrieved_at": "2026-07-29T23:46:51Z",
      "content_hash": null,
      "official": true,
      "supports": [
        "main-track acceptance and official title"
      ]
    },
    {
      "id": "src-891244f5f04e10d2-paper",
      "url": "https://www.ndss-symposium.org/ndss-paper/starshields-for-ios-navigating-the-security-cosmos-in-satellite-communication/",
      "kind": "paper-page",
      "title": "Starshields for iOS: Navigating the Security Cosmos in Satellite Communication",
      "publisher": "Internet Society",
      "retrieved_at": "2026-07-29T23:46:51Z",
      "content_hash": null,
      "official": true,
      "supports": [
        "published-order authors and affiliations",
        "abstract, PDF, slides, video, and submission cycle"
      ]
    },
    {
      "id": "src-69b5ebf26bc69b1d-crossref",
      "url": "https://api.crossref.org/works/10.14722/ndss.2025.240124",
      "kind": "crossref",
      "title": "Starshields for iOS: Navigating the Security Cosmos in Satellite Communication",
      "publisher": "Crossref",
      "retrieved_at": "2026-07-29T23:46:51Z",
      "content_hash": null,
      "official": false,
      "supports": [
        "DOI and main-proceedings membership"
      ]
    },
    {
      "id": "src-abstract-ndss-2025-6c204470",
      "url": "https://www.ndss-symposium.org/ndss-paper/starshields-for-ios-navigating-the-security-cosmos-in-satellite-communication/",
      "kind": "paper-page",
      "title": "Starshields for iOS: Navigating the Security Cosmos in Satellite Communication",
      "publisher": "NDSS",
      "retrieved_at": "2026-09-15T23:20:37Z",
      "content_hash": "sha256:245df0313073e40c3c48a09d181af7453592517898a1a8d836b7c1a409bfce3f",
      "official": true,
      "supports": [
        "Published abstract text."
      ]
    }
  ],
  "workflow": {
    "status": "READY_FOR_REVIEW",
    "owner": "agent-d",
    "updated_at": "2026-07-29T23:46:51Z",
    "notes": [
      "Canonical conference metadata collected from the official program and publisher or paper page."
    ]
  },
  "verification": {
    "collected_at": "2026-07-29T23:46:51Z",
    "last_verified_at": "2026-07-29T23:46:51Z",
    "collector_version": "agent-d-security-collector/1.0",
    "confidence": "HIGH",
    "verified_by": "agent-d",
    "unresolved_fields": [
      "page_count"
    ]
  }
}
