{
  "$schema": "https://systems-phd-explorer.local/schemas/v1/paper-metadata.schema.json",
  "schema_version": "1.0.0",
  "paper_id": "sp-2026-searching-for-a-farang-collective-security-among-women-i-050754a3",
  "title": "Searching for a Farang: Collective Security among Women in Pattaya, Thailand",
  "abstract": "We report on two months of ethnographic fieldwork in a women's centre in Pattaya, and interviews with 76 participants. Our findings, as they relate to digital security, show how (i) women in Pattaya, often working in the sex and massage industries, perceived relationships with farang men as their best, and sometimes only, option to achieve security; (ii) the strategies used by the women to appeal to a farang involved presenting themselves online, mirroring how they were being advertised by bar owners to attract customers; (iii) appealing to what they considered ‘Western ideals’, the women sought out ‘Western technologies’ and appropriated them for their benefit; (iv) the women navigated a series of online security risks, such as scams and abuse, which shaped their search for a farang; (v) the women developed collective security through knowledge-sharing to protect themselves and each other in their search for a farang. We situate our work in emerging digital security scholarship within marginalised contexts.",
  "abstract_source_id": "src-abstract-sp-2026-050754a3",
  "venue": "sp",
  "year": 2026,
  "track_or_session": "Cycle 1",
  "paper_type": "main-track",
  "publication_date": "2026-05-01",
  "page_count": 20,
  "venue_year_completion_status": "ACCEPTED_PAPERS_ONLY",
  "authors": [
    {
      "author_id": null,
      "name": "Taylor Robinson",
      "position": 1,
      "orcid": null,
      "affiliations": [
        {
          "institution_id": null,
          "name_as_published": "Royal Holloway, University of London",
          "normalized_name": null,
          "institution_type": "unknown",
          "city": null,
          "state_or_province": null,
          "country": null,
          "region": null,
          "source_ids": [
            "src-94885e016819f1ef-publisher"
          ]
        }
      ]
    },
    {
      "author_id": null,
      "name": "Rikke Bjerg Jensen",
      "position": 2,
      "orcid": null,
      "affiliations": [
        {
          "institution_id": null,
          "name_as_published": "Royal Holloway, University of London",
          "normalized_name": null,
          "institution_type": "unknown",
          "city": null,
          "state_or_province": null,
          "country": null,
          "region": null,
          "source_ids": [
            "src-94885e016819f1ef-publisher"
          ]
        }
      ]
    }
  ],
  "links": {
    "doi": "10.1109/sp63933.2026.00017",
    "official_page": "https://www.computer.org/csdl/proceedings-article/sp/2026/606500a298/2bojvjmxT3O",
    "official_pdf": "https://www.computer.org/csdl/api/v1/csdl/proceedings/download-article/2bojvjmxT3O/pdf",
    "artifact": null,
    "code": null,
    "project": null,
    "slides": null,
    "video": null,
    "bibtex": null
  },
  "alternate_versions": [],
  "sources": [
    {
      "id": "src-d3f734ac1fe116e7-program",
      "url": "https://sp2026.ieee-security.org/accepted-papers.html",
      "kind": "conference-program",
      "title": "IEEE Symposium on Security and Privacy 2026 Accepted Papers",
      "publisher": "IEEE",
      "retrieved_at": "2026-07-30T03:19:32Z",
      "content_hash": "sha256:ee58a5d42c2309a5ab38d0d1009f12e14758b1f062f1e3d456894b9ba10227ed",
      "official": true,
      "supports": [
        "main-track acceptance, official title, authors, affiliations, and cycle"
      ]
    },
    {
      "id": "src-94885e016819f1ef-publisher",
      "url": "https://www.computer.org/csdl/proceedings-article/sp/2026/606500a298/2bojvjmxT3O",
      "kind": "publisher-page",
      "title": "Searching for a Farang: Collective Security among Women in Pattaya, Thailand",
      "publisher": "IEEE Computer Society",
      "retrieved_at": "2026-07-30T03:19:32Z",
      "content_hash": null,
      "official": true,
      "supports": [
        "DOI, published-order authors and affiliations, abstract, publication date, page span, and PDF"
      ]
    },
    {
      "id": "src-abstract-sp-2026-050754a3",
      "url": "https://api.semanticscholar.org/graph/v1/paper/batch?fields=title,abstract,externalIds",
      "kind": "semantic-scholar",
      "title": "Searching for a Farang: Collective Security Among Women in Pattaya, Thailand",
      "publisher": "Semantic Scholar",
      "retrieved_at": "2026-09-15T22:58:02Z",
      "content_hash": "sha256:4204efad9387253e2c70bd18217fac7c5220b9cd43ecd6179fdc27c5a043343e",
      "official": false,
      "supports": [
        "Published abstract text."
      ]
    }
  ],
  "workflow": {
    "status": "READY_FOR_REVIEW",
    "owner": "agent-d",
    "updated_at": "2026-07-30T03:19:32Z",
    "notes": [
      "Canonical conference metadata was collected from the official program and paper or publisher page."
    ]
  },
  "verification": {
    "collected_at": "2026-07-30T03:19:32Z",
    "last_verified_at": "2026-07-30T03:19:32Z",
    "collector_version": "agent-d-security-collector/1.1-2026-ytd",
    "confidence": "HIGH",
    "verified_by": "agent-d",
    "unresolved_fields": []
  }
}
